<?xml version="1.0" encoding="UTF-8"?>
<households
  xmlns="http://www.matsim.org/files/dtd"
  xmlns:xsi="http://www.w3.org/2001/XMLSchema-instance"
  xsi:schemaLocation="http://www.matsim.org/files/dtd http://www.matsim.org/files/dtd/households.xsd">
  <household id="23">
    <members>
			<person refId="42" />
			<person refId="43" />
    </members>
    <location>
			<xCoord value="48.28"/>
			<yCoord value="7.56"/>
    </location>
    <income currency="eur">
			50000
    </income>
    <language name="SchwitzerdÃ¼tsch" /> 
    <type>
      StudentFlat
    </type>
  </household>

  <household id="24">
    <members>
			<person refId="44" />
			<person refId="45" />
    </members>

    <location>
      <facility refId="666" />
    </location>
  </household>
</households>